{
  "job_id": "00000000-0000-4000-8000-000000000001",
  "status": "done",
  "verdict": "violation",
  "violations": [
    {
      "type": "Тестовый тип FIXTURE-A",
      "timecode_sec": 12.345,
      "description": "[ТЕСТОВЫЕ ДАННЫЕ] На 12.345 с видно: синтетический объект. Требует проверки сотрудником. Источник: FIXTURE, не является нормой права.",
      "evidence_frames": [
        {
          "timestamp_sec": 12.345,
          "image_base64": "/9j/4AAQSkZJRgABAQAAAQABAAD/2wBDAAUDBAQEAwUEBAQFBQUGBwwIBwcHBw8LCwkMEQ8SEhEPERETFhwXExQaFRERGCEYGh0dHx8fExciJCIeJBweHx7/2wBDAQUFBQcGBw4ICA4eFBEUHh4eHh4eHh4eHh4eHh4eHh4eHh4eHh4eHh4eHh4eHh4eHh4eHh4eHh4eHh4eHh4eHh7/wAARCAFoAoADASIAAhEBAxEB/8QAHwAAAQUBAQEBAQEAAAAAAAAAAAECAwQFBgcICQoL/8QAtRAAAgEDAwIEAwUFBAQAAAF9AQIDAAQRBRIhMUEGE1FhByJxFDKBkaEII0KxwRVS0fAkM2JyggkKFhcYGRolJicoKSo0NTY3ODk6Q0RFRkdISUpTVFVWV1hZWmNkZWZnaGlqc3R1dnd4eXqDhIWGh4iJipKTlJWWl5iZmqKjpKWmp6ipqrKztLW2t7i5usLDxMXGx8jJytLT1NXW19jZ2uHi4+Tl5ufo6erx8vP09fb3+Pn6/8QAHwEAAwEBAQEBAQEBAQAAAAAAAAECAwQFBgcICQoL/8QAtREAAgECBAQDBAcFBAQAAQJ3AAECAxEEBSExBhJBUQdhcRMiMoEIFEKRobHBCSMzUvAVYnLRChYkNOEl8RcYGRomJygpKjU2Nzg5OkNERUZHSElKU1RVVldYWVpjZGVmZ2hpanN0dXZ3eHl6goOEhYaHiImKkpOUlZaXmJmaoqOkpaanqKmqsrO0tba3uLm6wsPExcbHyMnK0tPU1dbX2Nna4uPk5ebn6Onq8vP09fb3+Pn6/9oADAMBAAIRAxEAPwD59uv+PqX/AHz/ADqOpLr/AI+pf98/zqOugyCiiigAqS6/4+pf98/zqOpLr/j6l/3z/OgCOiiigAooooAkuv8Aj6l/3z/Oo6kuv+PqX/fP86joAKKKKACpLr/j6l/3z/Oo6kuv+PqX/fP86AI6KKKACiiigCS6/wCPqX/fP86jqS6/4+pf98/zqOgAooooAKkuv+PqX/fP86jqS6/4+pf98/zoAjooooAKKKKAJLr/AI+pf98/zqOpLr/j6l/3z/Oo6ACiiigAqS6/4+pf98/zqOpLr/j6l/3z/OgCOiiigAooooAkuv8Aj6l/3z/Oo6kuv+PqX/fP86joAKKKKACpLr/j6l/3z/Oo6kuv+PqX/fP86AI6KKKACiiigCS6/wCPqX/fP86jqS6/4+pf98/zqOgAooooAKkuv+PqX/fP86jqS6/4+pf98/zoAjooooAKKKKAJLr/AI+pf98/zqOpLr/j6l/3z/Oo6ACiiigAqS6/4+pf98/zqOpLr/j6l/3z/OgCOiiigAooooAkuv8Aj6l/3z/Oo6kuv+PqX/fP86joAKKKKACpLr/j6l/3z/Oo6kuv+PqX/fP86AI6KKKACiiigCS6/wCPqX/fP86jqS6/4+pf98/zqOgD0M6d4ai8O2+p22jWmqQWMVpNqKi8mhvI2LIsyzIxCmJmYqjxDjdHk5JB2rDwr4F0661XS9VP2+OHSBfjUxJIht0urq1jtZNgIB2QzCUqQcmQqfuivO7zxRrd5pX9mXF3G0BijhdhbxrLJHHjYjyhd7qu1cKzEDav90Yhn8QavN9r8273fbLGDT5/3aDfbw+V5SdOMeRFyOTt5JycqzGd7pfhjTNK8c+BfDut+H7W6k1Ypbamk084+c6ncW7OhjkXB8uNQOq8ZxkknK1LQYNc8I2Wt6Xp+jaXcyavfW06tqiwIyRxWrJtFzNkkGSQkqf4hntWDc+L/EVzq+i6tPqRkvdDihi06UxJmFYXLxjG3D4Yk5bJPfNUL/ULySzTSnmzZ291NcRR7R8skgjVznGTkRRjBOBt46nJYR6T4t8NaPpFrrb6b4f0OcW/ijV7BW1DVHheK3gEHlJGpnTzCPMfs5PGe2a/g6y8N6tb+CY7rwlpe7WPEraXdypcXYZoUNlyP32Ax8+TJx3GAMVyU3jbxDcJdJdzWF2Lq9nv5ftOmW0x8+fb5rqXjOzdsThcD5RgCqGm+INX03+y/sV35X9lXzahZfu0byrg+Vl+Qd3+pi4OR8vTk5LMZ0OqWmiaXHBoj6C95cTaNHfNqEUkhnWWW3E67VDeX5SbgrZUnCucjgCXSNKsl+GdvrK6Lol7dyalfQzTahqTQOscUNqyCJPPjDkGWQ8Kx5A9BWAvinXF0caULuP7OsLW6sbeMzLCxJMYm2+YEJJ+UNjkjHJrPl1C8k0m30p5s2dvPLcRR7R8skixq5zjJyIoxgnA28dTkA9Lt/B+g6n4mvdJFlNALfStN1XzYZGZ5d1pC88ChiRvleUlPRwFAweMC3uNCn8Bazqw8H6Qt1b6pa20DfaLs7I547tzx5+CV8lACR0BznNYuo+J9dmnZW1B12S27K0aKjA20YigO5QD8iAAc+p6kmqd1rWo3Nvf28syeTqF2l5cxpCiK0yCQKwCgbQBNJ8q4HzdOBgsB6TY+D/DknxC1fSn07Nnb/ECw0eKPz5Bts5JbtXjzuyciKMbidw28EZOZLLwvo8mh3OoT+HPDw1NNMmuY7dNYc2BC3lnCkhn+0YEmJbhSnm44jO3JGeEk8beJpLuxuzqKC4sbuO9ikW1iVmnjxslkIX964x1k3Hk+pzBo3ivXNI09tPs7i3No6yI0NxZwzowdonYESIwPzQRH2K8YycqzA1tD8KR67daveXVzp+i2NjPFA4trmGSMSSByqxvNcKrLiJznzGPHAPaWHSNGi03x3Y3Nql7qmkRmW31CK6YxALfW8HyIMBgwkkO5ieCuACMnDsPFGsWN7dXVrJZxm6KmaL7BAYCV5UiIp5akdiFBGT6mq82r6ilzrGLp2OqBor1nAZpl85JeSeQd8aNkYPHoTl6iM2iiimAUUUUASXX/H1L/vn+dR1Jdf8AH1L/AL5/nUdABRRRQAVJdf8AH1L/AL5/nUdSXX/H1L/vn+dAEdFFFABRRRQBJdf8fUv++f51HUl1/wAfUv8Avn+dR0AFFFFABUl1/wAfUv8Avn+dR1Jdf8fUv++f50AR0UUUAFFFFAEl1/x9S/75/nUdSXX/AB9S/wC+f51HQAUUUUAFSXX/AB9S/wC+f51HUl1/x9S/75/nQBHRRRQAUUUUASXX/H1L/vn+dR1Jdf8AH1L/AL5/nUdABRRRQAVJdf8AH1L/AL5/nUdSXX/H1L/vn+dAEdFFFABRRRQBJdf8fUv++f51HUl1/wAfUv8Avn+dR0AFFFFABUl1/wAfUv8Avn+dR1Jdf8fUv++f50AR0UUUAFFFFAEl1/x9S/75/nUdSXX/AB9S/wC+f51HQAUUUUAFSXX/AB9S/wC+f51HUl1/x9S/75/nQBHRRRQAUUUUASXX/H1L/vn+dR1Jdf8AH1L/AL5/nUdABRRRQAVJdf8AH1L/AL5/nUdSXX/H1L/vn+dAEdFFFABRRRQBJdf8fUv++f51HUl1/wAfUv8Avn+dR0AFFFFABUl1/wAfUv8Avn+dR1Jdf8fUv++f50AR0UUUAFFFFAEl1/x9S/75/nUdSXX/AB9S/wC+f51HQAUUUUAFSXX/AB9S/wC+f51HUl1/x9S/75/nQBHRRRQAUUUUASXX/H1L/vn+dR1Jdf8AH1L/AL5/nUdABRRRQAVJdf8AH1L/AL5/nUdSXX/H1L/vn+dAEdFFFABRRRQBJdf8fUv++f51HUl1/wAfUv8Avn+dR0AFFFFABUl1/wAfUv8Avn+dR1Jdf8fUv++f50AR0UUUAFFFFAEl1/x9S/75/nUdSXX/AB9S/wC+f51HQAUUUUAFSXX/AB9S/wC+f51HUl1/x9S/75/nQBHRRRQAUUUUASXX/H1L/vn+dR1Jdf8AH1L/AL5/nUdABRRRQAVJdf8AH1L/AL5/nUdSXX/H1L/vn+dAEdFFFABRRRQBJdf8fUv++f51HUl1/wAfUv8Avn+dR0AFFFFABUl1/wAfUv8Avn+dR1Jdf8fUv++f50AR0UUUAFFFFAEl1/x9S/75/nUdSXX/AB9S/wC+f51HQAUUUUAFSXX/AB9S/wC+f51HUl1/x9S/75/nQBHRRRQAUUUUASXX/H1L/vn+dR1Jdf8AH1L/AL5/nUdABRRRQAVJdf8AH1L/AL5/nUdSXX/H1L/vn+dAEdFFFABRRRQBJdf8fUv++f51HUl1/wAfUv8Avn+dR0AFFFFABUl1/wAfUv8Avn+dR1Jdf8fUv++f50AR0UUUAFFFFAEl1/x9S/75/nUdSXX/AB9S/wC+f51HQAUUUUAFSXX/AB9S/wC+f51HUl1/x9S/75/nQBHRRRQAUUUUASXX/H1L/vn+dR1Jdf8AH1L/AL5/nUdABRRRQAVJdf8AH1L/AL5/nUdSXX/H1L/vn+dAEdFFFABRRRQBJdf8fUv++f51HUl1/wAfUv8Avn+dR0AFFFFABUl1/wAfUv8Avn+dR1Jdf8fUv++f50AR0UUUAFFFFAEl1/x9S/75/nUdSXX/AB9S/wC+f51HQAUUUUAFSXX/AB9S/wC+f51HUl1/x9S/75/nQBHRRRQAUUUUASXX/H1L/vn+dR1Jdf8AH1L/AL5/nUdABRRRQAVJdf8AH1L/AL5/nUdSXX/H1L/vn+dAEdFFFABRRRQBJdf8fUv++f51HUl1/wAfUv8Avn+dR0AFFFFABUl1/wAfUv8Avn+dR1Jdf8fUv++f50AR0UUUAFFFFAEl1/x9S/75/nUdSXX/AB9S/wC+f51HQAUUUUAFSXX/AB9S/wC+f51HUl1/x9S/75/nQBHRRRQAUUUUASXX/H1L/vn+dR1Jdf8AH1L/AL5/nUdABRRRQAVJdf8AH1L/AL5/nUdSXX/H1L/vn+dAEdFFFABRRRQBJdf8fUv++f51HUl1/wAfUv8Avn+dR0AFFFFABUl1/wAfUv8Avn+dR1Jdf8fUv++f50AR0UUUAFFFFAEl1/x9S/75/nUdSXX/AB9S/wC+f51HQAUUUUAFSXX/AB9S/wC+f51HUl1/x9S/75/nQBHRRRQAUUUUASXX/H1L/vn+dR1Jdf8AH1L/AL5/nUdABRRRQAVJdf8AH1L/AL5/nUdSXX/H1L/vn+dAEdFFFABRRRQBJdf8fUv++f51HUl1/wAfUv8Avn+dR0AFFFFABUl1/wAfUv8Avn+dR1Jdf8fUv++f50AR0UUUAFFFFAEl1/x9S/75/nUdSXX/AB9S/wC+f51HQAUUUUAFSXX/AB9S/wC+f51HUl1/x9S/75/nQBHRRRQAUUUUASXX/H1L/vn+dR1Jdf8AH1L/AL5/nUdABRRRQAVJdf8AH1L/AL5/nUdSXX/H1L/vn+dAEdFFFABRRRQBJdf8fUv++f51HUl1/wAfUv8Avn+dR0AFFFFABUl1/wAfUv8Avn+dR1Jdf8fUv++f50AR0UUUAFFFFAEl1/x9S/75/nUdSXX/AB9S/wC+f51HQAUUUUAFSXX/AB9S/wC+f51HUl1/x9S/75/nQBHRRRQAUUUUASXX/H1L/vn+dR1Jdf8AH1L/AL5/nUdABRRRQAVJdf8AH1L/AL5/nUdSXX/H1L/vn+dAEdFFFABRRRQBJdf8fUv++f51HUl1/wAfUv8Avn+dR0AFFFFABUl1/wAfUv8Avn+dR1Jdf8fUv++f50AR0UUUAFFFFAEl1/x9S/75/nUdSXX/AB9S/wC+f51HQAUUUUAFSXX/AB9S/wC+f51HUl1/x9S/75/nQBHRRRQAUUUUASXX/H1L/vn+dR1Jdf8AH1L/AL5/nUdABRRRQAVJdf8AH1L/AL5/nUdSXX/H1L/vn+dAEdFFFABRRRQBJdf8fUv++f51HUl1/wAfUv8Avn+dR0AFFFFABUl1/wAfUv8Avn+dR1Jdf8fUv++f50AR0UUUAFFFFAEl1/x9S/75/nUdSXX/AB9S/wC+f51HQAUUUUAFSXX/AB9S/wC+f51HUl1/x9S/75/nQBHRRRQAUUUUASXX/H1L/vn+dR1Jdf8AH1L/AL5/nUdABRRRQAVJdf8AH1L/AL5/nUdSXX/H1L/vn+dAEdFFFABRRRQBJdf8fUv++f51HUl1/wAfUv8Avn+dR0AFFFFABUl1/wAfUv8Avn+dR1Jdf8fUv++f50AR0UUUAFFFFAEl1/x9S/75/nUdSXX/AB9S/wC+f51HQAUUUUAFSXX/AB9S/wC+f51HUl1/x9S/75/nQBHRRRQAUUUUASXX/H1L/vn+dR1Jdf8AH1L/AL5/nUdABRRRQAVJdf8AH1L/AL5/nUdSXX/H1L/vn+dAEdFFFABRRRQBJdf8fUv++f51HUl1/wAfUv8Avn+dR0AFFFFABUl1/wAfUv8Avn+dR1Jdf8fUv++f50AR0UUUAFFFFAEl1/x9S/75/nUdSXX/AB9S/wC+f51HQAUUUUAFSXX/AB9S/wC+f51HUl1/x9S/75/nQBHRRRQAUUUUASXX/H1L/vn+dR1Jdf8AH1L/AL5/nUdABRRRQAVJdf8AH1L/AL5/nUdSXX/H1L/vn+dAEdFFFABRRRQBJdf8fUv++f51HUl1/wAfUv8Avn+dR0AFFFFABUl1/wAfUv8Avn+dR1Jdf8fUv++f50AR0UUUAFFFFAEl1/x9S/75/nUdSXX/AB9S/wC+f51HQAUUUUAFSXX/AB9S/wC+f51HUl1/x9S/75/nQBHRRRQAUUUUASXX/H1L/vn+dR1Jdf8AH1L/AL5/nUdABRRRQAVJdf8AH1L/AL5/nUdfUnxT8ff8IP8A2d/xKf7Q+2+b/wAvHlbNmz/ZbOd/t0rycxzGrhatOlSpc8p3sr22s+qOzDYaFWMpzlyqNul9z5bor23/AIX5/wBSn/5Uf/tdH/C/P+pT/wDKj/8Aa6w/tDM/+gT/AMqR/wAi/q+F/wCf3/krPEqK9t/4X5/1Kf8A5Uf/ALXR/wAL8/6lP/yo/wD2uj+0Mz/6BP8AypH/ACD6vhf+f3/krPFrr/j6l/3z/Oo69vl+PWyV0/4RTO1iM/2h/wDa6b/wvz/qU/8Ayo//AGuj+0Mz/wCgT/ypH/IPq+F/5/f+Ss8Sor23/hfn/Up/+VH/AO10f8L8/wCpT/8AKj/9ro/tDM/+gT/ypH/IPq+F/wCf3/krPEqkuv8Aj6l/3z/Ovaf+F+f9Sn/5Uf8A7XTpfj1sldP+EUztYjP9of8A2uj+0Mz/AOgT/wAqR/yD6vhf+f3/AJKzxCivbf8Ahfn/AFKf/lR/+10f8L8/6lP/AMqP/wBro/tDM/8AoE/8qR/yD6vhf+f3/krPEqK9t/4X5/1Kf/lR/wDtdH/C/P8AqU//ACo//a6P7QzP/oE/8qR/yD6vhf8An9/5Kzxa6/4+pf8AfP8AOo69vl+PWyV0/wCEUztYjP8AaH/2um/8L8/6lP8A8qP/ANro/tDM/wDoE/8AKkf8g+r4X/n9/wCSs8Sor23/AIX5/wBSn/5Uf/tdH/C/P+pT/wDKj/8Aa6P7QzP/AKBP/Kkf8g+r4X/n9/5KzxKpLr/j6l/3z/Ovaf8Ahfn/AFKf/lR/+106X49bJXT/AIRTO1iM/wBof/a6P7QzP/oE/wDKkf8AIPq+F/5/f+Ss8Qor23/hfn/Up/8AlR/+10f8L8/6lP8A8qP/ANro/tDM/wDoE/8AKkf8g+r4X/n9/wCSs8Sor23/AIX5/wBSn/5Uf/tdH/C/P+pT/wDKj/8Aa6P7QzP/AKBP/Kkf8g+r4X/n9/5Kzxa6/wCPqX/fP86jr2+X49bJXT/hFM7WIz/aH/2um/8AC/P+pT/8qP8A9ro/tDM/+gT/AMqR/wAg+r4X/n9/5KzxKivbf+F+f9Sn/wCVH/7XR/wvz/qU/wDyo/8A2uj+0Mz/AOgT/wAqR/yD6vhf+f3/AJKzxKpLr/j6l/3z/OvpL4Z/E7/hNNen0v8AsT7B5Vq1x5n2rzM4ZFxjYP73XPavBPH/APyPniD/ALClz/6NatcBmVbEV50K1LklFJ/Env6IjEYWFOmqkJ8yem1jEooor2DjCiiigCS6/wCPqX/fP86jqS6/4+pf98/zqOgAooooAKkuv+PqX/fP86jqS6/4+pf98/zoAjooooAKKKKAJLr/AI+pf98/zqOpLr/j6l/3z/Oo6ACiiigAqS6/4+pf98/zqOpLr/j6l/3z/OgCOiiigAooooAkuv8Aj6l/3z/Oo6kuv+PqX/fP86joAKKKKACpLr/j6l/3z/Oo6kuv+PqX/fP86AI6KKKACiiigCS6/wCPqX/fP86jqS6/4+pf98/zqOgAooooAKkuv+PqX/fP86jqS6/4+pf98/zoAjooooAKKKKAJLr/AI+pf98/zqOpLr/j6l/3z/Oo6ACiiigAr239qb/mXP8At6/9pV4lXtv7U3/Muf8Ab1/7Srwsw/5GeE/7if8ApKO/D/7rW/7d/M8Sooor3TgCiiigCS6/4+pf98/zqOpLr/j6l/3z/Oo6ACiiigAqS6/4+pf98/zqOpLr/j6l/wB8/wA6AI6KKKACiiigCS6/4+pf98/zqOpLr/j6l/3z/Oo6ACiiigAqS6/4+pf98/zqOpLr/j6l/wB8/wA6AI6KKKACiiigCS6/4+pf98/zqOpLr/j6l/3z/Oo6ACiiigD1L9mb/kfL3/sFyf8Ao2KuI8f/API+eIP+wpc/+jWrt/2Zv+R8vf8AsFyf+jYq4jx//wAj54g/7Clz/wCjWrwsP/yN63+GJ31P9zh6sxKKKK904AooooAkuv8Aj6l/3z/Oo6kuv+PqX/fP86joAKKKKACpLr/j6l/3z/Oo6kuv+PqX/fP86AI6KKKACiiigCS6/wCPqX/fP86jqS6/4+pf98/zqOgAooooAKkuv+PqX/fP86jqS6/4+pf98/zoAjooooAKKKKAJLr/AI+pf98/zqOpLr/j6l/3z/Oo6ACiiigAqS6/4+pf98/zqOpLr/j6l/3z/OgCOiiigAooooAkuv8Aj6l/3z/Oo6kuv+PqX/fP86joAKKKKACpLr/j6l/3z/Oo6kuv+PqX/fP86AI6KKKACiiigCS6/wCPqX/fP86jqS6/4+pf98/zqOgAooooAK9t/am/5lz/ALev/aVeJV7b+1N/zLn/AG9f+0q8LMP+RnhP+4n/AKSjvw/+61v+3fzPEqKKK904AooooAkuv+PqX/fP86jqS6/4+pf98/zqOgAooooAKkuv+PqX/fP86jqS6/4+pf8AfP8AOgCOiiigAooooAkuv+PqX/fP86jqS6/4+pf98/zqOgAooooAKkuv+PqX/fP86jqS6/4+pf8AfP8AOgCOiiigAooooAkuv+PqX/fP86jqS6/4+pf98/zqOgAooooA9S/Zm/5Hy9/7Bcn/AKNiriPH/wDyPniD/sKXP/o1q7f9mb/kfL3/ALBcn/o2KuI8f/8AI+eIP+wpc/8Ao1q8LD/8jet/hid9T/c4erMSiiivdOAKKKKAJLr/AI+pf98/zqOpLr/j6l/3z/Oo6ACiiigAqS6/4+pf98/zqOpLr/j6l/3z/OgCOiiigAooooAkuv8Aj6l/3z/Oo6kuv+PqX/fP8